{
  "$schema": "../contracts/schemas/alpha-operating-policy.v1.schema.json",
  "schema_version": "aico.alpha-operating-policy/1.0",
  "policy_id": "alpha-operating-policy",
  "policy_version": "1.0.0",
  "status": "ACCEPTED",
  "authority": {
    "parent_issue": "duckvhuynh/aicompanyos#8",
    "product_repository": "duckvhuynh/aicompanyos",
    "product_commit": "28d2bc0ecd9e5676a4e87f1bf5e81c602a1a0714",
    "requirements": [
      "MVP-CAP-002",
      "MVP-CAP-007",
      "MVP-CAP-008",
      "MVP-CAP-010",
      "MVP-CAP-012",
      "PRD-FR-006–008",
      "PRD-FR-037",
      "PRD-FR-042–047",
      "SRS-FR-008–011",
      "SRS-FR-052",
      "SRS-FR-061–067",
      "SRS-FR-095",
      "SRS-NFR-004",
      "SRS-NFR-025–027",
      "SRS-TD-010"
    ]
  },
  "owners": {
    "product": { "role": "Product owner", "github_login": "duckvhuynh" },
    "design": { "role": "Design owner", "github_login": "duckvhuynh" },
    "qa": { "role": "QA owner", "github_login": "duckvhuynh" },
    "security": { "role": "Security owner", "github_login": "duckvhuynh" },
    "delivery": { "role": "Delivery owner", "github_login": "duckvhuynh" }
  },
  "review_by": "2026-11-20",
  "qualification": {
    "entries": [
      {
        "id": "A8V-QUAL-CATEGORIES",
        "configuration_key": "alpha.v1.goal.categories.allowed",
        "value": [
          "crud_workspace",
          "dashboard_reporting",
          "intake_onboarding",
          "catalog_directory",
          "planning_scheduling",
          "content_library"
        ],
        "unit": "enum_set",
        "owner_roles": ["Product", "Design"],
        "rationale": "A closed set of low-risk browser prototype shapes covers the fixed template while preventing an unreviewed general coding surface.",
        "reason_code": "GOAL_CATEGORY_UNSUPPORTED",
        "review_by": "2026-11-20"
      },
      {
        "id": "A8V-QUAL-PERSONAS",
        "configuration_key": "alpha.v1.goal.primary_personas.max",
        "value": 1,
        "unit": "count",
        "owner_roles": ["Product"],
        "rationale": "One primary persona keeps the outcome and acceptance criteria bounded enough for a five-screen prototype.",
        "reason_code": "GOAL_TOO_MANY_PERSONAS",
        "review_by": "2026-11-20"
      },
      {
        "id": "A8V-QUAL-FLOWS",
        "configuration_key": "alpha.v1.goal.primary_flows.max",
        "value": 1,
        "unit": "count",
        "owner_roles": ["Product", "Design"],
        "rationale": "The MVP value unit explicitly proves one primary user flow and requires a founder-authored narrowing decision for more.",
        "reason_code": "GOAL_TOO_MANY_FLOWS",
        "review_by": "2026-11-20"
      },
      {
        "id": "A8V-QUAL-ROUTES",
        "configuration_key": "alpha.v1.goal.routes.max",
        "value": 5,
        "unit": "count",
        "owner_roles": ["Product", "Design", "Engineering"],
        "rationale": "Five routes is the authoritative MVP ceiling and matches the accepted fixed-template architecture.",
        "reason_code": "GOAL_TOO_MANY_SCREENS",
        "review_by": "2026-11-20"
      },
      {
        "id": "A8V-QUAL-PLATFORM",
        "configuration_key": "alpha.v1.goal.output.platform",
        "value": "responsive_browser",
        "unit": "enum",
        "owner_roles": ["Product", "Design"],
        "rationale": "The first alpha evaluates responsive browser prototypes and explicitly excludes native, desktop, and extension output.",
        "reason_code": "GOAL_PLATFORM_UNSUPPORTED",
        "review_by": "2026-11-20"
      },
      {
        "id": "A8V-QUAL-TEMPLATE",
        "configuration_key": "alpha.v1.goal.template.key",
        "value": "react_typescript_template_v1",
        "unit": "enum",
        "owner_roles": ["Design", "Engineering", "Security"],
        "rationale": "The accepted sandbox decision permits one checksum-verified React and TypeScript template rather than arbitrary project stacks.",
        "reason_code": "GOAL_TEMPLATE_UNAVAILABLE",
        "review_by": "2026-11-20"
      },
      {
        "id": "A8V-QUAL-CLIENT-ONLY",
        "configuration_key": "alpha.v1.goal.runtime.client_only",
        "value": true,
        "unit": "boolean",
        "owner_roles": ["Product", "Engineering", "Security"],
        "rationale": "Client-only behavior prevents generated backends, production actions, credentials, and external business effects in the MVP.",
        "reason_code": "GOAL_REQUIRES_BACKEND",
        "review_by": "2026-11-20"
      },
      {
        "id": "A8V-QUAL-MOCK-DATA",
        "configuration_key": "alpha.v1.goal.data.mode",
        "value": "mock_local_only",
        "unit": "enum",
        "owner_roles": ["Product", "Security"],
        "rationale": "Local mock data supports demonstrations without customer, sensitive, credential, payment, or production-system data.",
        "reason_code": "GOAL_REQUIRES_REAL_DATA",
        "review_by": "2026-11-20"
      },
      {
        "id": "A8V-QUAL-DENIED",
        "configuration_key": "alpha.v1.goal.capabilities.denied",
        "value": [
          "production_deployment",
          "generated_backend",
          "production_database",
          "real_authentication",
          "real_payment",
          "email_delivery",
          "third_party_business_api",
          "sensitive_data",
          "native_mobile",
          "native_desktop",
          "browser_extension",
          "multi_user_collaboration",
          "multiple_primary_flows",
          "multiple_concurrent_initiatives",
          "custom_employees",
          "arbitrary_shell",
          "unrestricted_network",
          "external_business_action"
        ],
        "unit": "enum_set",
        "owner_roles": ["Product", "Security"],
        "rationale": "This closed denial registry converts authoritative MVP non-goals into deterministic qualification results without silently dropping requested behavior.",
        "reason_code": "GOAL_CAPABILITY_UNSUPPORTED",
        "review_by": "2026-11-20"
      },
      {
        "id": "A8V-QUAL-QUESTIONS",
        "configuration_key": "alpha.v1.goal.clarification_questions.max",
        "value": 5,
        "unit": "count",
        "owner_roles": ["Product"],
        "rationale": "Five focused questions is the SRS ceiling and avoids turning qualification into an unbounded conversation.",
        "reason_code": "GOAL_NEEDS_CLARIFICATION",
        "review_by": "2026-11-20"
      }
    ]
  },
  "attachments": {
    "entries": [
      {
        "id": "A8V-ATTACH-TYPES",
        "configuration_key": "alpha.v1.attachment.media_types.allowed",
        "value": [
          "text/plain",
          "text/markdown",
          "application/pdf",
          "image/png",
          "image/jpeg",
          "image/webp"
        ],
        "unit": "enum_set",
        "owner_roles": ["Product", "Security"],
        "rationale": "Plain text, Markdown, PDF, PNG, JPEG, and WebP cover necessary references while excluding active and executable document classes.",
        "reason_code": "ATTACHMENT_TYPE_UNSUPPORTED",
        "review_by": "2026-11-20"
      },
      {
        "id": "A8V-ATTACH-COUNT",
        "configuration_key": "alpha.v1.attachment.count.max",
        "value": 5,
        "unit": "count",
        "owner_roles": ["Product", "Security"],
        "rationale": "Five references provide useful product context while bounding scan, extraction, prompt, storage, and review load.",
        "reason_code": "ATTACHMENT_COUNT_EXCEEDED",
        "review_by": "2026-11-20"
      },
      {
        "id": "A8V-ATTACH-PER-FILE",
        "configuration_key": "alpha.v1.attachment.bytes.per_file_max",
        "value": {
          "text/plain": 262144,
          "text/markdown": 262144,
          "application/pdf": 10485760,
          "image/png": 5242880,
          "image/jpeg": 5242880,
          "image/webp": 5242880
        },
        "unit": "bytes",
        "owner_roles": ["Security", "Engineering"],
        "rationale": "Per-type byte ceilings bound parser and scanner exposure while allowing ordinary short documents and reference imagery.",
        "reason_code": "ATTACHMENT_TOO_LARGE",
        "review_by": "2026-11-20"
      },
      {
        "id": "A8V-ATTACH-AGGREGATE",
        "configuration_key": "alpha.v1.attachment.bytes.aggregate_max",
        "value": 20971520,
        "unit": "bytes",
        "owner_roles": ["Security", "Engineering"],
        "rationale": "A twenty MiB aggregate ceiling prevents multiple individually valid files from bypassing the run storage and processing budget.",
        "reason_code": "ATTACHMENT_TOTAL_EXCEEDED",
        "review_by": "2026-11-20"
      },
      {
        "id": "A8V-ATTACH-PDF-PAGES",
        "configuration_key": "alpha.v1.attachment.pdf.pages.max",
        "value": 50,
        "unit": "pages",
        "owner_roles": ["Product", "Security"],
        "rationale": "Fifty pages is enough for bounded product references without accepting long-document ingestion or unbounded extraction work.",
        "reason_code": "ATTACHMENT_PDF_TOO_LONG",
        "review_by": "2026-11-20"
      },
      {
        "id": "A8V-ATTACH-IMAGE-PIXELS",
        "configuration_key": "alpha.v1.attachment.image.pixels.max",
        "value": 20000000,
        "unit": "pixels",
        "owner_roles": ["Design", "Security"],
        "rationale": "A twenty-megapixel decoded-image ceiling prevents decompression abuse while retaining useful interface and visual references.",
        "reason_code": "ATTACHMENT_IMAGE_TOO_LARGE",
        "review_by": "2026-11-20"
      },
      {
        "id": "A8V-ATTACH-VALIDATION",
        "configuration_key": "alpha.v1.attachment.validation.required",
        "value": [
          "declared_type_allowlisted",
          "detected_type_allowlisted",
          "declared_matches_detected",
          "byte_limit",
          "sha256_verified",
          "malware_scan_clean",
          "active_content_absent",